{
  "accountId": "11111111-1111-4111-8111-111111111111",
  "contentHash": "2c65e7beafe73f1df5b6d48cbeaeab945efb2847108c2bece82e4a7db41e1906",
  "deviceId": "22222222-2222-4222-8222-222222222222",
  "deviceSequence": 1,
  "eventId": "33333333-3333-4333-8333-333333333333",
  "eventType": "purchase.registered",
  "occurrenceTime": "2026-07-14T12:00:00.000Z",
  "payload": {
    "purchase": {
      "accountId": "11111111-1111-4111-8111-111111111111",
      "currencyCode": "BRL",
      "id": "44444444-4444-4444-8444-444444444444",
      "items": [
        {
          "id": "55555555-5555-4555-8555-555555555555",
          "lineTotal": { "currencyCode": "BRL", "minorUnits": 1299 },
          "packageCount": 1,
          "productId": "66666666-6666-4666-8666-666666666666",
          "purchaseId": "44444444-4444-4444-8444-444444444444",
          "purchasedQuantity": {
            "decimalText": "1.000000",
            "kind": "mass",
            "microunits": 1000000,
            "unit": "kg"
          }
        }
      ],
      "occurrenceTime": "2026-07-14T12:00:00.000Z",
      "paymentMethodId": null,
      "personId": null,
      "store": {
        "accountId": "11111111-1111-4111-8111-111111111111",
        "displayName": "test-store",
        "id": "77777777-7777-4777-8777-777777777777"
      },
      "totalMinorUnits": 1299
    }
  },
  "payloadVersion": 3
}
